ID,CuratorialText,persona1_adapted,word_count_original,word_count_adapted,error
CT0001,"In the early 1940s, decades into his artistic career, Henri Matisse (1869–1954) turned his focus to a new medium: cut paper. 

He had become bedridden and unable to paint following an excruciating abdominal surgery, and cut paper allowed him to continue to create in his relatively sedentary state. Encouraged by his friend, the book publisher Tériade (the pseudonym of Stratis Eleftheriades), Matisse furthered his exploration of this new technique. He mined his memories of Parisian music halls, the circus, trips to Tahiti, folktales, and mythology, and produced a series of 20 cut-paper maquettes.","In the early 1940s, Henri Matisse (1869–1954) was already a well-known artist. But after decades of painting, he turned to a new way of making art: cut paper.

Matisse had a serious surgery on his stomach. After that, he was stuck in bed and could no longer paint. So he began cutting shapes out of paper. This let him keep making art even while lying down.

His friend Tériade, a book publisher, encouraged him to keep trying this new method. Matisse looked back on his memories—Paris music halls, the circus, trips to Tahiti, folktales, and myths. From these ideas, he created a set of 20 small models, or maquettes, made from cut paper.",93,113,
CT0002,"These vibrant original compositions were then faithfully reproduced using pochoir (stencil) and combined with an original text written by Matisse to form an unbound book, Jazz, that was published in 1947—when Matisse was 77 years old. Jazz caused an immediate international sensation and reinvigorated the aging artist, setting him on a new course of artistic discovery.","Matisse created these bright, original designs. He used a method called pochoir, which is a type of stencil printing, to make exact copies. He then paired them with his own writing to form a book called *Jazz*. The book was published in 1947, when Matisse was 77 years old. *Jazz* caused a huge stir around the world. It also gave the aging artist new energy and set him on a fresh path of artistic discovery.",56,75,
CT0003,"Matisse’s extraordinary images of Jazz are not only captivating and provocative in their own right but also reflect a practice devoted to the exploration of color and line. Throughout the artist’s decades-long career, he pushed color from the purely visual to the nearly transcendental and progressively simplified his line to the most elemental. But until his cut-outs, his color and line existed separately, one modifying the other but never fully unified—at least not to Matisse’s own satisfaction.","Matisse’s *Jazz* images are striking and thought-provoking. They also show his lifelong focus on color and line. Over many decades, Matisse pushed color beyond just what we see, making it feel almost spiritual. At the same time, he simplified his line drawings to their most basic form. But before his cut-outs, color and line stayed separate. Each one changed the other, but they never fully came together—at least not in a way that satisfied Matisse.",77,75,
CT0004,"This exhibition marks the first time Matisse’s Jazz will be shown in its entirety at the Art Institute; the museum acquired it in 1948. One of the most important livres d’artiste (artist books) of the 20th century, Jazz joins over 50 works from the museum’s renowned collection of paintings, sculpture, drawings, prints, illustrated books, and textiles to showcase the famed artist’s commitment across his 50-year career to continual innovation and the expressive power of color and line.","This exhibition is the first time Matisse’s *Jazz* will be shown in full at the Art Institute. The museum bought it in 1948. *Jazz* is one of the most important artist books of the 1900s. An artist book is a work of art made in the form of a book. This show also includes over 50 other works from the museum’s collection. These works include paintings, sculptures, drawings, prints, illustrated books, and textiles. Together, they show how Matisse spent his 50-year career always trying new things. He focused on the strong power of color and line.",77,96,
CT0005,"From 6th-century gilt bronze Buddhist sculpture through Joseon dynasty painting and white porcelain and contemporary paintings of the late 20th century, the works of art in this exhibition demonstrate the artistic legacy produced on the Korean peninsula over millennia.","This exhibition shows art made on the Korean peninsula over many centuries. You will see a Buddhist sculpture in gold from the 500s. There are also paintings and white porcelain from the Joseon dynasty. The collection includes modern paintings from the late 1900s. Together, these works reveal Korea's long artistic legacy.",39,51,
CT0006,"Once privately held, these artworks now belong to the Korean people thanks to a single groundbreaking gift from the family of Lee Kun-Hee, late chairman of Samsung Group. In 2021 the family donated over 23,000 works to the Korean government for public audiences to study and appreciate in perpetuity. Lee Kun-Hee and his father, Lee Byung-Chull, collected exceptional and storied objects from throughout Korean history as a means of preserving and celebrating the nation’s cultural heritage. This exhibition marks the first time the works are on public display. ","These artworks were once owned by one family. Now, they belong to the people of Korea. This change happened because of a very generous gift from the family of Lee Kun-Hee, the late chairman of Samsung Group. In 2021, the family gave over 23,000 artworks to the Korean government. The goal was for the public to study and enjoy them forever. Lee Kun-Hee and his father, Lee Byung-Chull, collected rare and important objects from Korean history. They did this to protect and celebrate the nation’s cultural heritage. This exhibition is the first time these works are shown to the public.",88,100,
CT0007,"Among the 140 artworks on view—including modern and historical painting, ceramics, and objects made for Buddhist worship and scholarly study—22 are officially recognized as National Treasures or Treasures by the Korean government. These objects are recognized as remarkable examples of their type and distinguished for their exceptional historic, artistic, and academic value.","Of the 140 artworks on display, 22 are officially called National Treasures or Treasures by the Korean government. These pieces include modern and historical paintings, ceramics, and objects made for Buddhist worship and scholarly study. They are seen as outstanding examples of their kind. They are also valued for their important history, art, and learning.",52,55,
CT0008,"The largest Art Institute exhibition devoted to Korean art in four decades, Korean National Treasures: 2,000 Years of Art charts the ideas, values, and traditions that have shaped the country’s creative production, from the Three Kingdoms period (57 BCE–676 CE) through the 1900s, offering insights into these objects’ rich meanings across centuries.","This exhibition is the largest show of Korean art at the Art Institute in 40 years. It is called *Korean National Treasures: 2,000 Years of Art*. The show explores the ideas, values, and traditions that have shaped Korean art. The artworks come from the Three Kingdoms period (57 BCE–676 CE) all the way to the 1900s. Together, they reveal the rich meanings these objects have held for centuries.",52,68,
CT0009,"Epic and intricate, monumental and meticulous—the paintings of Kashmir-raised, London-based artist Raqib Shaw offer fantastical meditations on identity, transformation, and the redemptive power of beauty.","Raqib Shaw grew up in Kashmir and now lives in London. His paintings are huge and full of tiny, careful details. They explore big ideas about who we are, how people change, and how beauty can help heal us.",25,39,
CT0010,"Born in Calcutta and raised in the verdant Himalayan mountains of Kashmir, Shaw draws deeply on the landscapes and memories of his early life, many of which were fractured by political upheaval. Forced to leave Kashmir as a teenager, he relocated first to New Delhi and later to London, where he studied at Central Saint Martins College of Art and Design. His work is influenced by a broad range of sources—Mughal and Persian miniatures, Renaissance altarpieces, Old Masters paintings, Japanese arts of the Momoyama period, Kashmiri and Urdu poetry, and Hindu and Western mythology—and yet his visual vocabulary and technique are all his own. His signature method involves applying an acrylic liner on gesso to create a golden line almost like the leading of a stained glass window. He then applies automobile enamel paints with needle-fine syringes and manipulates those with a porcupine quill, often adding glittering inset stones and baubles that further enhance the magical and dreamlike quality of the depicted scenes. ","Born in Calcutta and raised in the Himalayan mountains of Kashmir, Shaw draws deeply on the landscapes and memories of his early life. Many of those memories were broken by political conflict. Forced to leave Kashmir as a teenager, he moved first to New Delhi and later to London. There, he studied at Central Saint Martins College of Art and Design.

His work is influenced by many different sources. These include Mughal and Persian miniatures (small, detailed paintings), Renaissance altarpieces (religious artworks placed behind altars), Old Masters paintings (famous European artists from the past), Japanese arts from the Momoyama period, Kashmiri and Urdu poetry, and Hindu and Western mythology. Even so, his visual style and technique are entirely his own.

His signature method works like this: He uses an acrylic liner on a surface called gesso to create a golden line. This line looks like the leading in a stained glass window. Then he applies car enamel paints with needle-fine syringes. He moves the paint around with a porcupine quill. Often, he adds glittering stones and small decorations. These details make the scenes feel magical and dreamlike.",163,187,
CT0011,"At the Art Institute, Shaw debuts his more-than 100-feet-wide, 21-panel Paradise Lost (2009–25), the artist’s most ambitious and personal project to date. This magnificent allegorical painting takes viewers on a spellbinding journey, from the nocturnal solitude of the artist’s childhood in Kashmir to the frenzied daylight of the art world and the West to finally a fragile, renewed dawn. Each panel is dense with symbolism: mythical beasts, anthropomorphic hybrids, collapsing kingdoms, and natural beauty in various states of transformation. Throughout, the work is dotted with images of the artist, sometimes as a humanoid creature with different animal heads, at another time as a monkey looking with awe at the gleaming edifices and the wealth of the West, and sometimes unambiguously in full human form seated on a bed of saffron under a blossoming cherry tree, lost deep in his thoughts","At the Art Institute, Shaw shows his biggest and most personal project yet: *Paradise Lost* (2009–25). It is over 100 feet wide and made of 21 panels. This large, symbolic painting takes viewers on a journey. It starts in the quiet night of the artist’s childhood in Kashmir. Then it moves to the busy, bright day of the art world and the West. Finally, it ends with a fragile, new dawn.

Each panel is full of symbols. You can see mythical beasts, creatures that are part human and part animal, falling kingdoms, and natural beauty changing in different ways. Throughout the work, the artist appears many times. Sometimes he is a human-like creature with different animal heads. Other times he is a monkey staring in wonder at the shiny buildings and wealth of the West. And sometimes he is clearly in full human form, sitting on a bed of saffron under a blooming cherry tree, lost in his thoughts.",140,159,
CT0012,"The work is not a direct retelling of Milton’s 17th-century poem Paradise Lost, but rather a reflection on the many paradises lost across a lifetime: childhood innocence, creative freedom, mental tranquility, cultural belonging. “This is not just my story,” Shaw explained. “It is the story of each of us, and the story of our times.”","This artwork doesn't retell John Milton's 17th-century poem *Paradise Lost* directly. Instead, it reflects on the many ""paradises"" we lose throughout life. These include childhood innocence, creative freedom, mental peace, and a sense of cultural belonging. ""This is not just my story,"" Shaw explained. ""It is the story of each of us, and the story of our times.""",55,58,
CT0013,"While Shaw has previously shown the first chapter of Paradise Lost, this exhibition marks the first time all four chapters will be displayed, showcasing the fullest extent yet of this epic masterpiece. “This painting was made not only to document a life,” Shaw shared, “but to offer something to those who come after, to offer a space of reflection for emotional recognition and perhaps for quiet rebellion against forgetfulness. I do hope that this work invites the viewer to slow down and to look carefully and to feel without haste.”
","Shaw has shown the first chapter of *Paradise Lost* before. But this is the first time all four chapters are on display. It shows the full scope of this epic work.

“This painting was made not just to record a life,” Shaw said. “It was made to give something to future generations. It offers a space for reflection, for emotional recognition, and maybe for quiet rebellion against being forgotten. I hope this work asks viewers to slow down, look closely, and feel without rushing.”",90,84,
CT0014,"Exquisitely crafted and shrouded in mystery, Saint-Porchaire ceramics are among the rarest treasures of the French Renaissance.",Saint-Porchaire ceramics are beautifully made and full of mystery. They are some of the rarest treasures from the French Renaissance.,17,20,
CT0015,"Only around 70 examples are known to exist worldwide, and each one dazzles and intrigues with its refined and delicate modeling and astonishingly intricate decoration. Created between about 1520 and 1570 and closely associated with the royal courts of François I and Henri II, these extraordinary works bear the emblems of power, prestige, and desire—including the interlaced cipher of Henri II and his famed mistress, Diane de Poitiers.","Only about 70 of these objects are known to exist in the world. Each one amazes viewers with its fine, delicate shape and incredibly detailed decoration. Artists made them between about 1520 and 1570. They are closely linked to the royal courts of King François I and King Henri II of France. These special works show symbols of power, status, and desire. One example is the linked initials of Henri II and his famous mistress, Diane de Poitiers.",68,78,
CT0016,"Saint-Porchaire ceramics embody the sophistication and inventive spirit of Renaissance court culture. Fashioned from lead-glazed earthenware, their sculptural forms echo precious metalwork, while their ornamental patterns draw inspiration from textiles, bookbinding, and other luxury arts. Together, they express a unique and daring artistry, playful elegance, and refined taste at the height of French royal patronage.","Saint-Porchaire ceramics show the elegance and creative energy of Renaissance court life. They were made from lead-glazed earthenware, a type of pottery coated with a shiny finish. Their sculpted shapes look like fancy metalwork. Their decorative patterns come from fabrics, book covers, and other luxury items. Together, these pieces display a bold and original style, a playful grace, and a refined sense of beauty during the peak of French royal support for the arts.",55,74,
CT0017,"Beginning in March, the Art Institute will present an exceptional group of Saint-Porchaire ceramics from a private collection—most on public view for the first time since the late 1800s—in the Deering Family Galleries of Medieval and Renaissance Art, Arms, and Armor. These rare works will be shown alongside other notable examples of French Renaissance ceramics drawn from the Art Institute’s collection, including several recent acquisitions.","Starting in March, the Art Institute will show a special group of Saint-Porchaire ceramics from a private collection. Most of these pieces have not been seen by the public since the late 1800s. They will be on display in the Deering Family Galleries of Medieval and Renaissance Art, Arms, and Armor. These rare works will be shown next to other important examples of French Renaissance ceramics from the Art Institute’s own collection, including several pieces the museum recently acquired.",65,79,
CT0018,"Installed in the intimate James W. and Marilynn Alsdorf Gallery, this focused presentation invites close encounters with these remarkable jewel-like objects, while its placement within the broader context of the Deering Family Galleries highlights the rich dialogue between ceramics and the metalwork, textiles, and decorative arts that flourished during the Renaissance.","This exhibition is in the small James W. and Marilynn Alsdorf Gallery. It invites you to look closely at these beautiful, jewel-like objects. The gallery is part of the larger Deering Family Galleries. This setting shows how ceramics connected with metalwork, textiles, and other decorative arts. All of these crafts thrived during the Renaissance.",51,54,
CT0019,"Over a long and distinguished career, Japanese artist Hamanishi Katsunori (born 1949) has focused on making mezzotint prints, perhaps the most demanding of all print techniques.",Japanese artist Hamanishi Katsunori (born 1949) has had a long and respected career. He focuses on making mezzotint prints. Mezzotint is a printmaking technique that is very difficult to master.,26,30,
CT0020,"Mezzotints are known for their dark and atmospheric appearance. This is because the starting point for any mezzotint is the creation of a roughened surface, which produces a solid black background when printed. To draw the image that emerges from this dark background, the artist uses a series of burnishers and scrapers; the deepest gouges print as white areas on the finished print.","Mezzotints are known for their dark, moody look. That’s because the artist starts by making the surface rough. When printed, this rough surface creates a solid black background. To make the image appear from the darkness, the artist uses tools called burnishers and scrapers. The deepest scratches show up as white areas in the final print.",63,56,
CT0021,"This presentation includes earlier, smaller-format works done without color, as well as more recent larger work that boast many hues. Among the earlier monochromatic prints is Hamanishi’s 1997 Viva Chicago series, which focuses on the city’s beloved public monuments like the Picasso and Miró sculptures. As the artist recalled, “When I first came here, I was unprepared for the impact this city would leave on my mind, such a vivid impression etched deep in my memory… . This is my ode to Chicago.”","This exhibit shows two types of art. First, there are smaller, earlier works made without color. Second, there are larger, newer works that use many colors.

One of the early black-and-white prints is from Hamanishi’s 1997 *Viva Chicago* series. It focuses on the city’s famous public monuments, like the Picasso and Miró sculptures.

The artist remembered: “When I first came here, I was unprepared for the impact this city would leave on my mind, such a vivid impression etched deep in my memory… . This is my ode to Chicago.”",83,90,
CT0022,"The exhibition also celebrates several important gifts to the museum. Hamanishi’s 2022 Four Seasons series—shown here for the first time—is a recent gift from the artist. Each work in the series is reminiscent of the panels of a folding screen and features seasonal floral imagery. Many works in the show come from the 2013 gift to the museum from the Ninion and Sheldon Landy Collection, which gave the Art Institute the largest collection of Hamanishi’s prints in the world.",This exhibition also celebrates important gifts to the museum. Hamanishi’s *Four Seasons* series from 2022 is shown here for the first time. The artist recently gave these works to the museum. Each piece in the series looks like the panels of a folding screen. They show flowers and plants from each season. Many works in the show come from a 2013 gift. The Ninion and Sheldon Landy Collection gave the Art Institute the largest collection of Hamanishi’s prints in the world.,79,81,
CT0023,"“There is no work by Carroll Dunham that does not use drawing as a foundation.”  
—Carroll Dunham. Over the course of five decades, Dunham has engaged in wide-ranging formal and thematic experimentation across various media, yet his drawings represent a distinct, interconnected body of work. Dunham’s mature artistic career began in 1970s New York amid a scene dominated by Minimalist aesthetics. Using simple elements such as line, shape, and color, he made a tremendous impact with work that nevertheless signaled a return to subject matter. In the intervening decades, Dunham has continued to produce drawings that test, and ultimately collapse, the porous boundaries between abstraction and figuration: bodies shapeshift into buildings, trees pose like models, the cellular resembles the cosmic, and internal organs or private parts are made very public.
","“There is no work by Carroll Dunham that does not use drawing as a foundation.”  
—Carroll Dunham  

For over fifty years, Dunham has tried many different styles and subjects. He has worked with many types of art materials. Still, his drawings form a special and connected group of works.  

Dunham’s serious art career began in New York City in the 1970s. At that time, a style called Minimalism was very popular. Minimalist art used simple shapes and colors. Dunham used simple elements like lines, shapes, and colors too. But his work also brought back clear subjects and stories. This made a big impact.  

Over the years, Dunham has kept making drawings that mix two styles: abstract art (which does not show real objects) and figurative art (which shows real things like people or places). In his drawings, these styles blend together. Bodies change into buildings. Trees stand like models. Tiny cells look like huge galaxies. Private body parts become very public.",130,161,
CT0024,"Working in series, Dunham methodically tests out every possible outcome of a drawing’s composition or content. This approach seems to spontaneously yield new imagery and ideas that link one body of work to the next. His influences are likewise wide-ranging—art history, philosophy, psychoanalysis, and evolutionary science as well as science fiction and comic books—all of which inform his explorations of the tension between male and female, nature and culture, self and other.","Dunham works in series. He carefully tries out every possible version of a drawing's layout or subject. This method seems to naturally create new images and ideas. These ideas connect one group of his work to the next. His influences come from many places. They include art history, philosophy, psychology, and evolutionary science. He also draws from science fiction and comic books. All of these sources shape his work. He explores the tension between male and female, nature and culture, and self and other.",72,84,
CT0025,"Dunham foregrounds the development of his work by precisely dating each drawing. This practice is evidenced in the thousands of drawings he has organized into an archive, from which this show is derived. Developed in conversation with the artist, this comprehensive survey is the first museum presentation focused exclusively on Dunham’s drawings. Encompassing a 50-year period and featuring many drawings making their public debut, it celebrates the medium central to Dunham’s expansive practice.","Dunham shows how his work has grown over time by giving each drawing an exact date. He has done this with thousands of drawings, which he keeps in an organized collection. This exhibition comes from that collection. The artist helped plan this show. It is the first museum exhibit to focus only on Dunham’s drawings. The drawings span 50 years, and many are on public display for the first time. This exhibit celebrates drawing, which is the main part of Dunham’s wide-ranging art.",73,83,
CT0026,"In fall of 2024, the Art Institute unveiled a newly imagined and installed gallery for the arts of Korea—our first space fully dedicated to this cultural region.","In fall 2024, the Art Institute opened a new gallery for Korean art. It is our first space fully focused on this culture.",27,23,
CT0027,"The new installation presents a wider range of objects than previous displays—extending from ceramics to textiles and painting and spanning 2,000 years from the Three Kingdoms period (about 57 BCE–676 CE) until today. Intentionally located between the Chinese and Japanese art galleries, the thoughtful display offers insight into how these artworks both reflect the religious and material culture of Korea and how they relate to the arts of Korea’s influential neighbors, China and Japan.","This new exhibit shows a wider variety of Korean art than before. It includes ceramics, textiles, and paintings. The artworks span 2,000 years, from the Three Kingdoms period (about 57 BCE–676 CE) to today. The gallery sits between the Chinese and Japanese art rooms on purpose. This thoughtful layout helps visitors see how Korean art reflects the country’s religious and material culture. It also shows how these artworks connect to the art of Korea’s powerful neighbors, China and Japan.",74,79,
