ID,CuratorialText,persona1_adapted,word_count_original,word_count_adapted,error
CT0200,"Dive into the artistic process of one of history’s most beloved and influential artists. A true titan of the Italian Renaissance, Raffaello di Giovanni Santi (1483–1520)—better known as Raphael—matched ambition with lyricism to create works with both intellectual heft and emotional depth, a necessary skill in the complex political landscape of Renaissance courts. In his short life of only 37 years, he achieved such profound success as a painter, designer, and architect that he was regarded as the pinnacle of artistic perfection for centuries after his death. Raphael: Sublime Poetry is the first comprehensive exhibition on Raphael in the United States, bringing together more than 170 of the artist’s greatest masterpieces and rarely seen treasures to illuminate the brilliance of Raphael’s extraordinary creativity. The son of a painter and poet, Raphael engaged with the foremost writers and thinkers of his age in Rome, displaying a poetic sensibility that captivated his peers and generations that followed. Follow the full breadth of his life and career, from his origins in Urbino to his rise in Florence, where he began to emerge as a peer of Leonardo da Vinci and Michelangelo, to his final, prolific decade at the papal court in Rome. To underscore the range of his genius, this presentation brings together important drawings, paintings, and tapestries from public and private collections across Europe and the United States, many of which have never been shown together. With particular attention to Raphael’s portrayal of women—from his use of nude female models for the first time in Western art to his tender depictions of the Madonna and Child—and recent scientific discoveries made using state-of-the-art technology, this exhibition offers a rare opportunity to experience the genius of an artist who helped shape the course of art history.","**Meet Raphael: A Star of the Renaissance**

Step into the world of one of history’s most famous and influential artists. Raffaello di Giovanni Santi (1483–1520)—better known as Raphael—was a giant of the Italian Renaissance. He combined big ideas with beautiful, emotional images. This skill was important in the tricky political world of Renaissance courts.

In his short life of just 37 years, Raphael became a huge success as a painter, designer, and architect. For centuries after his death, people saw him as the perfect artist.

**The Exhibition: *Raphael: Sublime Poetry***

This is the first major exhibition of Raphael’s work in the United States. It brings together over 170 of his greatest pieces and rare treasures. Together, they show the brilliance of Raphael’s amazing creativity.

Raphael was the son of a painter and a poet. In Rome, he worked with the top writers and thinkers of his time. His work had a poetic feel that amazed his peers and many generations after them.

**His Life and Career**

Follow the full story of his life and work. It starts in his hometown of Urbino. Then it moves to Florence, where he began to match the skills of Leonardo da Vinci and Michelangelo. Finally, it ends in Rome, where he spent his last, most productive years working for the pope.

To show the range of his genius, this exhibition brings together important drawings, paintings, and tapestries. These come from public and private collections across Europe and the United States. Many of them have never been shown together before.

**What Makes This Exhibition Special**

The exhibition pays special attention to how Raphael painted women. For example, he was one of the first Western artists to use nude female models. He also created tender images of the Madonna and Child (Mary and baby Jesus).

In addition, the show includes recent scientific discoveries made with modern technology. This exhibition offers a rare chance to experience the genius of an artist who helped shape the course of art history.",292,332,
CT0201,"One of the greatest influencers of all time, Raphael (1483 –1520) was idolized for more than three centuries, in Europe and beyond, as the painter of supreme perfection and the role model for artists in training. During his short life, his contemporaries celebrated his enormous creative facility, and later his fame towered above that of other Italian Renaissance stars. Born Raffaello di Giovanni Santi, the ambitious young artist soon left behind his modest origins in the Marche region of central Italy in search of important patrons in Umbria and Tuscany. In Florence, then the capital of the European art world, he emerged as a peer to the elder Leonardo and Michelangelo. Raphael spent his final decade as the favorite artist of the popes in Rome, where he was praised as the “prince of painters.” A savvy businessman and impresario, he worked with well-organized teams of assistants and collaborators to propagate his inventions and style, spawning a new generation of noteworthy artists.","Raphael (1483–1520) was one of the most influential artists of all time. For more than 300 years, people in Europe and beyond admired him as a perfect painter. He was also a role model for artists learning their craft.

During his short life, other artists praised his huge creative talent. Later, his fame grew even greater than other famous Italian Renaissance stars. Born Raffaello di Giovanni Santi, he was an ambitious young artist. He left his modest home in the Marche region of central Italy. He went looking for important supporters in Umbria and Tuscany.

In Florence, which was then the capital of the European art world, Raphael became an equal to the older masters Leonardo and Michelangelo. He spent his last ten years in Rome as the favorite artist of the popes. There, people called him the ""prince of painters.""

Raphael was also a smart businessman and organizer. He worked with well-organized teams of assistants and helpers. Together, they spread his ideas and style. This helped create a new generation of important artists.",161,174,
CT0202,"This first comprehensive U.S. exhibition on Raphael provides an immersive look at his meteoric career. Together, the drawings, paintings, prints, and tapestries on view present a portrait of his dashing artistic personality and astonishingly creative mind. This is also the story of an artist who was born to a poet-painter, became an intimate friend to literary figures, and tried his hand at composing sonnets. Raphael lived and worked in a culture accustomed to thinking of painting and poetry as intertwined sister arts. The elegance and dramatic force of his imagery still have the power to invoke the ancient dictum, much discussed in his time, that “painting is a mute poetry, and poetry is a blind painting.”","This first big U.S. show on Raphael gives you a close-up look at his fast rise to fame. The drawings, paintings, prints, and tapestries on display show his bold artistic style and amazing creativity. This is also the story of an artist whose father was a poet and painter. Raphael became close friends with writers and even tried writing sonnets, which are 14-line poems. He lived in a time when people saw painting and poetry as connected arts. The grace and power of his images still bring to life an old saying from his era: “Painting is silent poetry, and poetry is blind painting.”",116,104,
CT0203,"Raphael was born on April 6, 1483, in Urbino, a hill town set in a spectacular, rugged landscape in the Marche region, in east central Italy. The artist’s roots in Urbino, with its refined court life and unique intellectual heritage, played a defining role in his life and career. He proudly identified with his birthplace and signed his paintings “RAPHAEL VRBINAS” to the end of his days.","Raphael was born on April 6, 1483, in Urbino, Italy. Urbino is a hill town in the Marche region, in east central Italy. The area has a dramatic, rocky landscape. Urbino was known for its elegant court life and rich intellectual history. These qualities shaped Raphael’s life and work. He was proud of his hometown. Throughout his career, he signed his paintings “RAPHAEL VRBINAS,” which means “Raphael of Urbino.”",67,69,
CT0204,"Raphael received his earliest training from his father, Giovanni Santi (ca. 1439–1494), a court painter and prolific poet. During Raphael’s childhood, Giovanni was busy composing an epic poem on Federico III da Montefeltro (1422–1482), the famous ruler who had brought peace, wealth, and fame to the Duchy of Urbino. A formidable general, scholar, and patron of art and architecture, Federico transformed his court into an internationally celebrated center for the arts and humanist learning. He founded a fabled library and rebuilt Urbino’s imposing Palazzo Ducale, whose rhythmic arcades and harmonic geometry embodied the humanist dedication to mathematics that distinguished the culture of Urbino. Those same ideals are evident in the vibrant architectural visions—enlivened with perspectival effects and classical references—created by Urbino painters.","Raphael’s first art lessons came from his father, Giovanni Santi. Giovanni was a painter at court and also wrote many poems. When Raphael was a child, his father was working on a long poem about Federico III da Montefeltro. Federico was a famous ruler who brought peace, wealth, and fame to the Duchy of Urbino. He was a strong general, a scholar, and a supporter of art and building projects. Federico turned his court into a world-famous center for the arts and humanist learning. Humanism was a way of thinking that focused on human potential and achievements. He built a legendary library and rebuilt Urbino’s huge palace, the Palazzo Ducale. The palace had rows of arches and balanced shapes that showed the humanist love for math. This love for math was a key part of Urbino’s culture. You can see the same ideas in the lively city scenes painted by Urbino artists. Their paintings used perspective, which makes things look far away, and included references to ancient Greek and Roman art.",122,171,
CT0205,"Raphael’s father soon brought his precocious son to study with Pietro Perugino (1446/50–1523), an artist he likely knew through local projects. A brilliant, prolific painter and draftsman with active workshops in Perugia and Florence, Perugino relied heavily on collaboration with assistants to meet the demands of patrons all over Italy. Raphael coursed quickly through the stages of pupil and apprentice to become first a collaborator to Perugino and then an independent artist. Perugino’s elegant figures, breathtaking command of technique, and efficient methods for reproducing designs left their mark on the younger artist.","Raphael's father noticed his son's early talent. He soon sent the young artist to study with Pietro Perugino (1446/50–1523). Perugino was a painter and draftsman—someone who creates detailed drawings. He was very skilled and produced a lot of work. He had busy workshops in Perugia and Florence. To keep up with orders from patrons (people who pay for art) all over Italy, Perugino often worked with assistants.

Raphael moved quickly through the stages of training. First, he was a pupil, then an apprentice. Soon, he became a collaborator with Perugino. Finally, he became an independent artist. Perugino's graceful figures, amazing technical skill, and fast ways of copying designs had a strong influence on the younger artist.",92,116,
CT0206,"Ambitious, studious, and disciplined, the young Raphael first sought to establish himself as an independent professional in Città di Castello, a small, wealthy town near Perugia, where he painted notable church altarpieces. Confraternities, religious institutions for regular citizens devoted to works of charity, were also major sources of patronage for artists in Umbria and the Marche. Gathered here are paintings and related studies done for confraternities by Perugino and the young Raphael—including the first painting fully in Raphael’s hand, as confirmed by its recent conservation treatment.","Raphael was ambitious, hardworking, and eager to learn. As a young artist, he first tried to build his own career in Città di Castello, a small but wealthy town near Perugia. There, he painted important altarpieces for churches.

Confraternities were also major supporters of artists in the regions of Umbria and the Marche. These were religious groups for everyday people who did charitable work.

In this room, you can see paintings and related studies made for confraternities by Perugino and the young Raphael. One of these works is the first painting done entirely by Raphael himself. Recent conservation work confirmed this.",86,101,
CT0207,"From 1500 to 1507, the young Raphael endeavored to cultivate patrons by painting both monumental altarpieces and small-scale devotional works in the regions of the Marche, Umbria, and Tuscany. An iconic example is the large, multipart painting at the center of this gallery, made for nuns in Perugia and now known as the Colonna Altarpiece (after a later owner). The full ensemble is reunited here as a complete work for the first time since it was dismembered around 1663 and the individual paintings dispersed. Other notable projects include a mammoth altarpiece for the Baronci family chapel in Città di Castello, which was later destroyed in an earthquake and survives only in fragments and preliminary drawings, and a remarkable altarpiece for the Oddi family chapel in Perugia, represented here by studies and the painting that provided its base.","Between 1500 and 1507, the young artist Raphael worked to win the support of wealthy patrons. He painted large altarpieces (big religious paintings placed behind church altars) and small devotional works (paintings meant for private prayer). He did this in the Italian regions of the Marche, Umbria, and Tuscany.

A key example is the large, multi-part painting in the center of this gallery. It was made for nuns in Perugia. Today, it is called the Colonna Altarpiece, named after a later owner. This is the first time the whole set of paintings has been shown together since it was taken apart around 1663. The individual pieces were scattered after that.

Other important projects include a huge altarpiece for the Baronci family chapel in Città di Castello. It was later destroyed in an earthquake. Only fragments and early drawings survive. There is also a remarkable altarpiece for the Oddi family chapel in Perugia. Here, you can see studies and the painting that formed its base.",137,164,
CT0208,"Full-scale drawings for the Oddi Altarpiece reveal the workshop practices that Raphael had absorbed during his training and collaboration with Perugino. Dazzling studies on paper also show how he worked in a variety of media—black chalk, pen and ink, and metalpoint on prepared paper—often with a virtuosic command of technique. Drawings such as these likely served as his calling card and undoubtedly impressed his patrons.","Full-scale drawings for the Oddi Altarpiece show how Raphael learned workshop methods from his training and work with Perugino. These bright studies on paper also reveal how he used different materials—black chalk, pen and ink, and metalpoint on prepared paper—often with great skill. Drawings like these probably acted as his calling card and surely impressed his clients.",65,57,
CT0209,"Raphael may have been drawn to Florence after hearing fellow painters rave about rival full-scale designs (cartoons) for spectacular murals there by Leonardo and Michelangelo. Related works in this gallery convey the electrifying novelty and arresting sculptural power of those unrealized projects. While in Florence between 1504 and 1508, Raphael also studied Michelangelo’s sculptures and Leonardo’s paintings and drawings, promptly and seamlessly adapting aspects of their styles and techniques in his work.","Raphael might have moved to Florence because other painters couldn't stop talking about the huge mural designs by Leonardo and Michelangelo. These designs were called ""cartoons,"" which are full-scale drawings used to plan large paintings. The artworks in this gallery show how exciting and powerful those unfinished projects were. While living in Florence from 1504 to 1508, Raphael also studied Michelangelo's sculptures and Leonardo's paintings and drawings. He quickly and smoothly borrowed parts of their styles and methods for his own work.",72,82,
CT0210,"Raphael also learned from his peers’ revolutionary approaches to inventing compositions. Leonardo’s theories about “sketching quickly,” in the fervor of artistic inspiration, transformed Raphael’s methods. Asserting that the effort to finish drawings and puzzle out details could dry up fresh ideas, Leonardo advised working out concepts in “rough sketches,” like a poet scrawling the first draft of a verse in messy handwriting with crossed-out words. Before Florence, Raphael had tended to develop compositions in a more artisanal way, figure by detailed figure, as he had learned from Perugino. Now, spontaneous sketching led him to more organic compositions pulsating with movement and vivid expression.","Raphael also learned from other artists his age. They had new, bold ways of creating compositions. Leonardo’s ideas about “sketching quickly” changed how Raphael worked. Leonardo believed that spending too much time on details could kill fresh ideas. He said artists should work in “rough sketches.” This is like a poet writing a messy first draft of a poem, with crossed-out words. Before moving to Florence, Raphael made art in a more careful, step-by-step way. He drew one figure in detail at a time, just as his teacher Perugino had taught him. But after learning from Leonardo, Raphael started sketching freely. This helped him create more natural compositions. His art became full of movement and strong emotion.",103,117,
CT0211,"The exposure to Leonardo’s and Michelangelo’s art infused Raphael’s compositions with a sense of space, sculptural monumentality, and expressive force. This was the result of an enormous amount of experimentation on paper. Sequences of drawings—from a sheet of sketches to studies of an arrangement based on three-dimensional clay or wax models—reveal Raphael’s increasingly disciplined approach to the design process. Working in orderly steps, for example, he gradually animated a pyramidal composition (favored by Leonardo), which could seem static, by building a dynamic interplay of gestures and gazes among the figures.","Seeing the art of Leonardo and Michelangelo changed how Raphael worked. His paintings gained a stronger sense of space, bigger-looking figures, and more powerful emotions. This came from a huge amount of experimenting on paper.

Raphael made many drawings in a series. He started with quick sketches. Then he studied how to arrange figures using small clay or wax models. These steps show how Raphael became more careful and organized in his design process.

For example, he worked step by step to bring life to a pyramid-shaped composition. (Leonardo liked this shape.) A pyramid can look still or boring. But Raphael made it feel active by building a lively give-and-take of gestures and looks between the figures.",90,117,
CT0212,"In 1507 the twenty-four-year-old Raphael painted his most significant work before his move to Rome, an altarpiece of Christ’s entombment for the Baglioni family chapel in Perugia. The preliminary drawings show him in full command of his powers as a storyteller, and demonstrate how he constructed a dramatic composition with a climactic narrative. Through arduous study, aided by his knowledge of classical sculpture, the artist evolved a static arrangement of figures into an emotionally arresting action scene. Raphael had absorbed Leonardo’s principle that the physical gestures of the body express the “motions” of the mind and soul.","In 1507, the twenty-four-year-old Raphael painted his most important work before moving to Rome. It was an altarpiece—a large painting placed above an altar in a church. This one showed the burial of Christ. He made it for the Baglioni family chapel in Perugia.

His early sketches show he was a master storyteller. They reveal how he built a dramatic scene with a powerful, climactic moment. Through hard work and his knowledge of ancient Roman statues, Raphael turned a still group of figures into an emotionally gripping action scene. He had learned from Leonardo da Vinci that the body’s movements show the “motions” of the mind and soul.",97,108,
CT0213,"For centuries Raphael has been widely admired for Madonna and Child paintings that include a display of tenderness. From about 1300, Byzantine icons of the Eastern Orthodox faith had featured a form of the Madonna known as the Virgin Eleousa, from the Greek for “compassionate,” in which Mary embraces the Christ Child as he touches his cheek to hers. Disseminated widely, the imagery inspired numerous medieval and Renaissance artists, including Italian sculptors and painters. Raphael drew upon this model and thoroughly transformed it.","For centuries, people have admired Raphael’s paintings of Mary and the baby Jesus. These works show a gentle, loving bond. Around the year 1300, Byzantine religious art from the Eastern Orthodox Church featured a type of Mary called the Virgin Eleousa. “Eleousa” comes from a Greek word meaning “compassionate.” In these images, Mary holds the Christ Child close as he touches his cheek to hers. This image spread widely and inspired many artists from the Middle Ages and the Renaissance, including Italian sculptors and painters. Raphael used this model as a starting point, but he changed it in his own way.",83,101,
CT0214,"Raphael’s ability to capture a mood of vitality and innocent playfulness, especially while maintaining a superior command of anatomical realism, is striking in light of the historical realities of childbirth, infancy, and parenthood in his time. The rare account book displayed here records funerary expenses for Raphael’s mother, who died of childbirth-related complications in 1491, and for two of his siblings who died in infancy. Knowledge of gynecology and obstetrics was scarce, pregnancy and childbirth extremely dangerous, and infant mortality rates astronomically high. These facts, along with a desire among Renaissance artists to humanize religious subjects, all contributed to the appeal of the tender Madonna and Child as votive figures and subjects in art.","Raphael was great at showing energy and innocent playfulness in his art. He also had a strong understanding of how the human body really looks. This is surprising when you think about what life was like for mothers and babies in his time.

The rare account book on display here lists funeral costs for Raphael’s mother. She died from childbirth problems in 1491. It also lists costs for two of his siblings who died as babies.

Back then, people knew very little about women’s health and childbirth. Pregnancy and giving birth were very dangerous. Many babies did not survive.

These facts help explain why paintings of the Madonna and Child were so popular. Renaissance artists wanted to make religious subjects feel more human. So tender images of mother and child became common in art.",114,134,
CT0215,"Despite his great ambitions, Raphael was largely thwarted in his attempts to break into the competitive art market in Florence. He found his most feasible source of patronage among the city’s wealthy merchants, who commissioned portraits and tender devotional paintings, mainly of the Madonna and Child. Raphael continued to produce works on this subject for private patrons well after his move to Rome in 1508, and many of his collaborators followed his example.","Raphael had big dreams, but he struggled to succeed in Florence's tough art market. His best chance for work came from the city's rich merchants. They paid him to paint portraits and gentle religious scenes, mostly of Mary and the baby Jesus. Raphael kept making these kinds of paintings for private buyers even after he moved to Rome in 1508. Many of his assistants copied his style.",73,67,
CT0216,"Raphael sought to bring the lauded ethereal physical beauty of the Madonna into radiant being. He was not immune to the convention, sung by poets both within and beyond his circle, that favored an elegant, aristocratic lady with dainty facial features and golden hair, but he also strove for long-established Christian ideals. Sermons, prayers, songs, and poetry inspired by early church writings had praised the Virgin’s beauty and grace as mirrors of her unique spiritual perfection. He infused his representations with a humanity and psychological presence revealed through gestures and reactions. Raphael’s paintings display an arresting command of light, color, space, and geometry, and his renderings of infants are more naturalistic in their proportions, poses, and expressions than those of many of his peers.","Raphael wanted to show the Virgin Mary’s famous, heavenly beauty in his paintings. He followed a popular style that poets in his circle also used. This style favored elegant, noble women with delicate features and golden hair. But Raphael also aimed for older Christian ideals. Church writings, sermons, prayers, songs, and poetry had long praised Mary’s beauty and grace. They saw these as signs of her perfect spiritual nature. Raphael added a human touch to his images. He showed Mary’s feelings through her gestures and reactions. His paintings also show a strong understanding of light, color, space, and shape. And his baby Jesus figures look more natural in their size, poses, and expressions than those by many other artists of his time.",124,122,
