ID,CuratorialText,persona1_adapted,word_count_original,word_count_adapted,error
CT0499,"Pottery Protocorinthian alabastron decorated with a lion and two griffins; wheel-made; depressed-ovoid body on a rounded base; small mouth with a sloping rim; pierced lug handle at the top; made of fine buff clay and slip, with painted decoration which has fired black; also added purple paint on the animal bodies; details of the figures are incised. The main frieze shows two griffins separated by stylised tree-like motif; a lion occupies the space between the two mythical beasts; filling motifs in the field. Above the main scene is a frieze of stylised floral designs; below simpler motifs composed of dots separated by S-shaped strokes. Simple rays on the vase, and tongues on the lip.","This is a small pottery container called an alabastron. It was made in ancient Corinth. The potter shaped it on a wheel. The body is round and sits on a curved base. The mouth is small with a slanted rim. A small handle sticks out from the top.

The artist used fine, light-colored clay and a thin coating called slip. The painted decoration turned black when fired. The artist also added purple paint on the animals. Details of the animals were scratched into the clay.

The main band of decoration shows two griffins. A griffin is a mythical creature with the head and wings of an eagle and the body of a lion. A tree-like design separates the two griffins. A lion fills the space between them. Small shapes fill the empty areas around the animals.

Above the main scene is a band of flower-like designs. Below are simpler patterns made of dots and S-shaped lines. The bottom of the vase has simple lines like rays. The lip has tongue-shaped designs.",114,171,
CT0500,IWM holds approximately 11 million photographs of modern conflict from the First World War to present day.,"IWM has about 11 million photos. These pictures show modern wars, from World War I to today.",17,17,
CT0501,"The collection covers the activities of British and Commonwealth forces and international perspectives. Photographs from official, press, and private perspectives such as soldiers, nurses and civilians who participated in or witnessed conflict reveal the human impact of war. The collection includes notable photographers such as Olive Edis, Bill Brandt and Tim Hetherington.","This collection shows the activities of British and Commonwealth forces, as well as views from around the world. The photos come from official sources, the press, and private individuals. Soldiers, nurses, and civilians who took part in or saw conflict took these pictures. Their images reveal how war affects people. The collection includes famous photographers like Olive Edis, Bill Brandt, and Tim Hetherington.",52,63,
CT0502,The photographs can be viewed alongside original documents which help us understand how and why these photographs were taken.,The photographs are displayed with original documents. These documents help us learn how and why the photos were taken.,19,19,
CT0503,"Uniforms, Flags, Badges and Insignia
An important and international collection of flags and uniforms, the latter representing all of the armed services and institutions of not only Great Britain and the Commonwealth, but Allies as well as former enemies along with their associated badges and insignia.","**Uniforms, Flags, Badges, and Insignia**

This is a large and important collection from around the world. It includes flags and uniforms from many different countries. The uniforms come from all branches of the military and other official groups. They represent not only Great Britain and the Commonwealth, but also allies and former enemies. Each uniform has its own badges and insignia, which are special symbols that show rank or membership.",46,70,
CT0504,"Mementoes and Miscellanea
A diverse collection containing objects of personal significance, including escape and evasion items, prisoner of war and civilian internee items, trench art, battlefield souvenirs, commemorative objects, foodstuffs, currency, tobacciana, toys and games, Kindertransport and Holocaust related items, home-front and peace-time items.","**Mementoes and Miscellanea**

This collection holds many different kinds of objects. Each one has a personal story. You will find items used to escape or avoid capture. There are things made by prisoners of war and civilians held in camps. You can see ""trench art""—objects soldiers made from war materials. There are also souvenirs from battlefields and items made to remember people or events. The collection includes food, money, and smoking items. Toys and games are here too. Some objects relate to the Kindertransport, which saved children from the Holocaust. Others show life on the home front or during peacetime.",44,100,
CT0505,"Orders, Medals and Decorations
An important collection comprising orders, medal and decorations issued to service personnel and civilians.","**Orders, Medals, and Decorations**

This is a major collection of awards given to both military members and civilians. It includes orders, medals, and decorations.",18,24,
CT0506,"Equipment
An extensive collection of equipment used in twentieth and twenty-first-century warfare, including radios, cipher machines, radars, cameras, medical equipment and even pigeon baskets.","**Equipment**

This section shows a wide range of tools used in wars from the 1900s to today. You'll find radios, code-making machines, radar systems, cameras, medical supplies, and even baskets for carrier pigeons.",24,33,
CT0507,"Weapons and Ammunition
A major reference collection that includes firearms, edged weapons, trench clubs or concussive weapons, ordnance and munitions.","**Weapons and Ammunition**

This is a large collection of reference items. It includes guns, bladed weapons, trench clubs (used for hitting), and other military supplies like bombs and bullets.",20,29,
CT0508,"Vehicles, Aircraft and Ships
An internationally renowned collection including models, battle tanks, maritime equipment and aircraft components. Most of the collection of artillery and large military equipment is on show at IWM London or IWM Duxford.","**Vehicles, Aircraft and Ships**

This collection is famous around the world. It includes models, battle tanks, ship equipment, and aircraft parts. Most of the artillery and large military equipment is on display at IWM London or IWM Duxford.",36,38,
CT0509,"IWM’s Sound Collection is home to over 35,000 recordings relating to conflicts since 1914.  It is the largest oral history archive of its kind in the world, with more than 60,000 hours of material and interviews in over 15 different languages.  Beyond interviews it also includes speeches, sound effects, radio broadcasts and music. The collection covers the wartime experiences of ordinary men and women- from soldiers and activists, to factory workers and journalists. It also includes notable figures such as Field Marshal Bernard Montgomery and Vera Lynn.  Our unique collection of oral history interviews has formed the basis for significant academic research as well as featuring heavily in bestselling books, films, TV and radio broadcasts and podcasts. Many thousands of our audio recordings can be listened to via the IWM website, which is regularly updated with new additions.","IWM’s Sound Collection holds over 35,000 recordings about conflicts since 1914. It is the largest oral history archive of its kind in the world. Oral history means people tell their own stories out loud. The collection has more than 60,000 hours of material. It includes interviews in over 15 languages. Besides interviews, it also has speeches, sound effects, radio shows, and music. The collection covers the wartime experiences of everyday people. These include soldiers, activists, factory workers, and journalists. It also features famous people like Field Marshal Bernard Montgomery and singer Vera Lynn. Our unique collection of oral history interviews has helped with major academic research. It has also been used in bestselling books, films, TV shows, radio programs, and podcasts. You can listen to many thousands of these recordings on the IWM website. The site adds new recordings regularly.",138,140,
CT0510,"IWM has managed a Film Archive for over a century. From its very beginnings as an institution IWM understood the importance of film as primary source material and its extensive collection illustrates the causes, course and consequences of conflict from the First World War to the present day. A remarkable resource for researchers and film-makers
Our constantly growing collection now extends to over 25,000 hours of moving images, representing a wide and diverse range of material from public and service information films, documentaries and unedited combat film, through to official newsreels and amateur films. Two substantial collections from NATO and the United Nations in the former Yugoslavia are also held. An ongoing film digitisation programme provides free online access, with newly-digitised media added as soon as it becomes available.","IWM has managed a Film Archive for over 100 years. From the very start, the museum knew that film was an important primary source—a firsthand record of events. This large collection shows the causes, course, and consequences of conflict from World War I to today. It is a valuable resource for researchers and filmmakers.

Our collection keeps growing. It now has over 25,000 hours of moving images. This includes a wide range of material: public and service information films, documentaries, unedited combat footage, official newsreels, and amateur films. We also hold two large collections from NATO and the United Nations in the former Yugoslavia. A film digitisation programme—converting old film into digital files—gives free online access. Newly-digitised media is added as soon as it becomes available.",129,126,
CT0511,"Private Papers
IWM holds over 20,000 individual collections of private papers, principally comprising unpublished diaries, letters and memoirs written primarily by British and Commonwealth servicemen and women since 1914 and by civilians mainly during the two world wars. We also hold many important documents from victims and survivors of the Holocaust.","**Private Papers**

IWM keeps more than 20,000 private paper collections. These are mostly unpublished diaries, letters, and memoirs. British and Commonwealth soldiers and nurses wrote them from 1914 onward. Civilians wrote them mainly during the two world wars. We also hold many important documents from people who survived or were victims of the Holocaust.",51,54,
CT0512,"Foreign and Related Documents
We also look after a large collection of foreign documents, including the official British records of the major war crimes trials conducted at Nuremberg and Tokyo, together with related documents from the Second World War which mainly concern the German and Japanese war efforts.","**Foreign and Related Documents**

We also take care of a large collection of foreign documents. This includes the official British records from the major war crimes trials held in Nuremberg and Tokyo. It also includes related documents from World War II. These mostly deal with the German and Japanese war efforts.",48,51,
CT0513,"This exceptional collection is one of the most important representations of twentieth century British art in the world. It includes many great works of art from the British government war art schemes of the First and Second World Wars, which employed the greatest artists of their day, including leaders of the avant garde. These included Paul Nash, C R W Nevinson, John Singer Sargent and Sir William Orpen.  IWM also holds the unique War Artists Archive, which reveals the day-to-day running of the war art schemes and gives fascinating glimpses of the artists' experiences.","This collection is one of the most important displays of 20th-century British art anywhere in the world. It includes many great works from British government war art programs during World War I and World War II. These programs hired the best artists of the time, including leaders of the avant-garde—artists who tried new, bold styles. Some of these artists were Paul Nash, C R W Nevinson, John Singer Sargent, and Sir William Orpen. IWM also holds the unique War Artists Archive. This archive shows how the war art programs worked day to day. It also gives fascinating glimpses into the artists' experiences.",94,102,
CT0514,"Our Library collection consists of over 150,000 items covering twentieth and twenty-first century conflict involving British and Commonwealth countries. Along with material on military units and campaign histories, we have biographies, manuals, items relating to the economic, social, and cultural aspects of war, journals, newspapers, ephemera, propaganda, and e-resources.","Our library has more than 150,000 items. They cover wars from the 1900s to today that involved Britain and Commonwealth countries. We have materials about military groups and battle histories. You can also find biographies, manuals, and items about the economic, social, and cultural sides of war. There are journals, newspapers, short-lived printed items (ephemera), propaganda, and online resources.",49,59,
CT0515,"image: HMS Laurentic is seen sinking in the background, with half of the ship submerged and her bow rising up out of the water. In the foreground is a lifeboat full of sailors illuminated against the dark by a small light. Another lifeboat is visible on the right and small dots of light in the background indicate further lifeboats. In the background on the left, the top of the German U-boat is visible. HMS Laurentic, originally a P&O liner, was equipped with 6"" guns in 1939 and converted into an armed merchant cruiser. She was Worsley's first ship and he remained with her until she was sunk off Foreland, Ulster by the U-boat captain Otto Kretschmer (U-99) on the night of 3 November 1940. Worsley painted the original immediatly afterwards, while on survivors leave. The WAAC bought the picture and in August 1942 sent it to South America in a touring exhibition of war art. On the way, however, the ship was torpedoed and the present picture was painted as a replacement, at the request of the WAAC. (From exhibition catalogue, Burstow Gallery, Brighton, 1995)","**The Sinking of HMS Laurentic**

This painting shows the moment HMS Laurentic was sinking. Half of the ship is underwater, and its front end (the bow) sticks up into the air. In the front of the painting, a lifeboat filled with sailors glows in the dark, lit by a small light. Another lifeboat appears on the right, and tiny dots of light in the background show more lifeboats. On the left, you can see the top of the German submarine (called a U-boat) that attacked the ship.

HMS Laurentic started as a passenger ship for the P&O shipping company. In 1939, it was fitted with 6-inch guns and turned into an armed merchant cruiser—a warship that also carried cargo. This was the first ship the artist, Frank Worsley, served on. He stayed with it until it was sunk off the coast of Foreland, Ulster, by German U-boat captain Otto Kretschmer on the night of November 3, 1940.

Worsley painted the first version of this scene right after the attack, while on leave as a survivor. The War Artists' Advisory Committee (WAAC) bought that painting. In August 1942, they sent it to South America as part of a traveling show of war art. But on the way, the ship carrying it was torpedoed and the painting was lost. So, at the WAAC's request, Worsley painted this replacement.",185,226,
CT0516,"image: a canopy of camouflage nets suspended over a road that leads to a cluster of industrial buildings painted with a camouflage patters. A group of figures gather in the background.
History note
War Artists Advisory Committee purchase","**Image Description:**
A canopy of camouflage nets hangs over a road. The road leads to a group of industrial buildings painted with a camouflage pattern. In the background, a group of people gather.

**History Note:**
The War Artists Advisory Committee bought this artwork.",38,43,
CT0517,"image: a coastal radar station with the radar equipment and masts in the centre background. In the foreground are several buildings with personnel in dark uniforms milling around outside. The sea is visible in the background to the left.
History note
War Artists Advisory Committee purchase","**The Image**
This painting shows a coastal radar station. Radar equipment and tall masts stand in the center background. In the foreground, several buildings sit near the water. People in dark uniforms are gathered outside. The sea is visible in the background on the left.

**History Note**
The War Artists Advisory Committee bought this artwork.",46,55,
CT0518,"image: The burnt-out wreck of a fire engine lying in an empty landscape. There is a heavy sky above, and several buildings visible on the horizon in the far right of the composition.
History note
War Artists Advisory Committee purchase","**The Burnt-Out Fire Engine**

A fire engine sits destroyed in an empty landscape. The sky above is heavy and dark. On the far right, several buildings can be seen on the horizon.

This painting was bought by the War Artists Advisory Committee.",40,42,
CT0519,"Object description
image: a half-length portrait of Andrew Nures Nabarro wearing his fireman's uniform with his hat under his arm.
Physical description
image: a half-length portrait of Andrew Nures Nabarro wearing his fireman's uniform with his hat under his arm. It is an oil paint on canvas. The frame is of painted wood with glass glazing. There is a hardboard backboard.","This is a painted portrait of Andrew Nures Nabarro. He is shown from the chest up. He wears his fireman's uniform and holds his hat under his arm.

The artist used oil paint on canvas to create the image. The painting sits in a wooden frame with a glass front. The back of the frame is made of hardboard.",61,59,
CT0520,"Object description
image: Two warships moored at Plymouth dock with hundreds of people standing on the dockside in the foreground. There are two cranes on either side of the composition and other vessels are visible on the water in the background.
History note
War Artists Advisory Committee commission","**Object Description**

This painting shows two warships tied up at a dock in Plymouth. In the front, hundreds of people stand on the dockside. Two cranes sit on either side of the scene. In the background, you can see other boats on the water.

**History Note**

The British government's War Artists Advisory Committee asked an artist to make this painting.",48,60,
CT0521,"Object description
image: A view looking down at men sitting in rows, listening to the proceedings at the Nuremberg trials through headphones. Behind them is a row of soldiers.
History note
War Artists Advisory Committee commission","**Object description**  
This photo shows a view looking down at men sitting in rows. They are listening to the Nuremberg trials through headphones. Behind them, a row of soldiers stands guard.

**History note**  
The War Artists Advisory Committee asked an artist to create this work.",36,45,
CT0522,"Object description
Image: A view of a pond from a boat. On the pond are floating supports, suspending a large camouflage net over the water. To the right is another boat containing three men inspecting the nets.
Physical description
Framed and mounted watercolour painting.","**Object Description**

This painting shows a view of a pond from a boat. Floating supports hold up a large camouflage net over the water. On the right, another boat carries three men who are checking the nets.

**Physical Description**

This is a watercolour painting. It is framed and mounted.",44,49,
CT0523,"Object description
image: A reconstruction of the sinking of a number of merchant ships by German U-boats in the North Atlantic. Merchant sailors and debris from a destroyed ship are in the water in the foreground. To the right a merchant ship is in the process of sinking, with the stern end submerged and the bow end pointing skywards. In the background, other merchant vessels are being hit by enemy fire.","This image shows a reconstruction of German submarines (called U-boats) attacking and sinking merchant ships in the North Atlantic. In the front of the scene, merchant sailors and wreckage from a destroyed ship float in the water. On the right side, a merchant ship is sinking. Its back end is underwater, and its front end points up toward the sky. In the background, enemy fire hits other merchant ships.",71,69,
CT0524,"A rough for a furniture mural. whole: text is split between left, middle and right side, with separate images associated with each. image: (left) blueprint illustrating furniture with aircraft, tanks and ships in background. (middle) various types of furniture arranged over a blueprint of a house with factories in the background. (right) birds eye view of a port, mainly in yellow, with modern buildings and furniture floating above the buildings. text: FROM WAR PRODUCTION THROUGH AUSTERITY TO BETTER TIMES","This is a rough sketch for a mural about furniture. The design is split into three parts: left, middle, and right. Each part has its own image and text.

On the left, there is a blueprint. It shows furniture with aircraft, tanks, and ships in the background.

In the middle, different types of furniture are arranged over a house blueprint. Factories are in the background.

On the right, there is a bird’s-eye view of a port. It is mostly yellow. Modern buildings and furniture float above the buildings.

The text reads: ""FROM WAR PRODUCTION THROUGH AUSTERITY TO BETTER TIMES.""",79,99,
CT0525,"image: A view across a tree-lined road to a high wall bordering a railway cutting. The wall has grafitti on it which reads 'Nuclear state = Police state' followed by an anarchy symbol and then 'One World'. Behind the wall to the right is a large industrial building. Further to the right is a junction with a road leading off to the left.'In the summer of 1983 ... I discovered the old train station in Mildmay Grove and started what became a set of ten drawings of the section of line between Canonbury and Kingsland Road. It was while doing the second drawing that I realized the line I was looking at was used several times a week to take nuclear waste from Sizewell [nuclear power station] to Sellafield [nuclear fuel reprocessing plant]. Over the next six weeks, I found it impossible to escape that realization, and it inextricably meshed with every mark I made.' [Eric Rimmington, from the exhibition catalogue 'A World's Waste: Cumbria, Sellafield and Nuclear Reprocessing, A Brewery Arts Centre Touring Exhibition' 1987.] The artist made this series of drawings at a time of intense anti-nuclear protests against both nuclear weapons and the nuclear power industry. The 1979 decision by the British Government to allow American Cruise Missiles to be sited in the UK sparked a series of marches and protests. These included the Greenham Common Women's Peace Camp, started in 1981 and which was at its height in 1983 when the missiles finally arrived at the Berkshire base. The accident at Three Mile Island, a nuclear power station in Pennsylvania, USA, also in 1979, heightened fears about the safety of nuclear power. Nuclear waste and its transport and storage continues to be a focus of protest and anxiety. The Greater London Assembly commissioned a report into the safety of nuclear waste trains in 2001 for this reason.","**The Artwork and Its Story**

This drawing shows a view down a tree-lined road. On one side, there is a high wall next to a railway cutting. The wall has graffiti that reads ""Nuclear state = Police state."" It also has an anarchy symbol and the words ""One World."" Behind the wall on the right is a large industrial building. Further right, there is a road junction with a road leading off to the left.

**The Artist's Experience**

In the summer of 1983, the artist Eric Rimmington discovered an old train station in Mildmay Grove. He started making ten drawings of the railway line between Canonbury and Kingsland Road. While working on the second drawing, he realized something important. The train line he was drawing was used several times a week to carry nuclear waste. The waste came from Sizewell nuclear power station and went to Sellafield, a nuclear fuel reprocessing plant.

Over the next six weeks, Rimmington could not stop thinking about this fact. He said it became mixed up with every mark he made in his drawings.

**The Historical Context**

Rimmington made these drawings during a time of strong anti-nuclear protests. People were protesting against both nuclear weapons and nuclear power plants.

In 1979, the British Government decided to allow American Cruise Missiles to be placed in the UK. This decision sparked many marches and protests. One famous protest was the Greenham Common Women's Peace Camp, which started in 1981. It was at its peak in 1983, when the missiles finally arrived at the base in Berkshire.

Also in 1979, a serious accident happened at Three Mile Island, a nuclear power station in Pennsylvania, USA. This accident made people even more worried about the safety of nuclear power.

**The Issue Today**

Nuclear waste, and how it is transported and stored, is still a major concern. People continue to protest about it. In fact, in 2001, the Greater London Assembly ordered a report on the safety of nuclear waste trains. This shows that the issue remains important even today.",311,340,
